{
  "$schema": "https://json-schema.org/draft/2020-12/schema",
  "$id": "https://aic.local/schemas/fa-hardware-v2.json",
  "title": "AIC standalone FlashAttention hardware specification",
  "type": "object",
  "additionalProperties": false,
  "required": [
    "schema_version",
    "sm_count",
    "clock_hz",
    "shared_memory_per_sm_bytes",
    "l2_capacity_bytes",
    "l2_bandwidth_bytes_s",
    "hbm_bandwidth_bytes_s",
    "matrix_peak_flops",
    "vector_peak_flops",
    "exp_flop_equivalent"
  ],
  "properties": {
    "schema_version": {"const": 2},
    "sm_count": {"type": "integer", "minimum": 1},
    "clock_hz": {"type": "number", "exclusiveMinimum": 0},
    "shared_memory_per_sm_bytes": {"type": "integer", "minimum": 1},
    "l2_capacity_bytes": {"type": "integer", "minimum": 1},
    "l2_bandwidth_bytes_s": {"type": "number", "exclusiveMinimum": 0},
    "hbm_bandwidth_bytes_s": {"type": "number", "exclusiveMinimum": 0},
    "matrix_peak_flops": {
      "type": "object",
      "minProperties": 1,
      "additionalProperties": {"type": "number", "exclusiveMinimum": 0}
    },
    "vector_peak_flops": {"type": "number", "exclusiveMinimum": 0},
    "exp_flop_equivalent": {"type": "number", "exclusiveMinimum": 0}
  }
}
