{
  "schema_version": 2,
  "sm_count": 132,
  "clock_hz": 1830000000.0,
  "shared_memory_per_sm_bytes": 262144,
  "l2_capacity_bytes": 52428800,
  "l2_bandwidth_bytes_s": 9369600000000.0,
  "hbm_bandwidth_bytes_s": 3350000000000.0,
  "matrix_peak_flops": {
    "fp8": 1979000000000000.0,
    "fp16": 989000000000000.0,
    "bf16": 989000000000000.0,
    "fp32": 67000000000000.0
  },
  "vector_peak_flops": 123724800000000.0,
  "exp_flop_equivalent": 35.0
}
